{
  "continent": "c08",
  "premise": "content/world/premises/continent-08.json",
  "generator": {
    "name": "mapforge",
    "version": "3.0.0",
    "seed": "7c9e4a2f8b1d6e03",
    "epoch": 0
  },
  "seaLevel": 0.04,
  "cellKm": 0.5,
  "cellCensus": {
    "land": 11988,
    "lake": 0,
    "unowned": 0
  },
  "ownerHistogram": {
    "c08/r01": 1785,
    "c08/r02": 1785,
    "c08/r03": 1785,
    "c08/r04": 1785,
    "c08/r05": 1784,
    "c08/r06": 640,
    "c08/r07": 1784,
    "c08/r08": 640
  },
  "outerRing": [[213.5,332.5],[214,332.5],[214,332],[218,327.5],[219,327.5],[220.5,325.5],[221.5,325.5],[222.5,324],[223.5,324],[224,323],[225.5,322.5],[226,322.5],[226,322],[226.5,322],[227,322],[227,321.5],[228,321.5],[228,321],[230.5,320.5],[230.5,320],[232,320],[232,319.5],[233.5,319.5],[233.5,319],[235,319],[235,318.5],[239.5,318],[239.5,317.5],[242.5,317.5],[242.5,317],[246.5,317],[246.5,316.5],[258.5,316.5],[258.5,317],[261,317],[261,317.5],[262.5,317.5],[262.5,318],[264.5,318],[264.5,318.5],[266,318.5],[266,319],[267.5,319],[267.5,319.5],[268.5,319.5],[268.5,320],[269.5,320],[269.5,320.5],[270.5,320.5],[270.5,321],[271.5,321],[271.5,321.5],[272.5,321.5],[273,322.5],[274,322.5],[274.5,323.5],[275.5,323.5],[276,324.5],[277,324.5],[279.5,327.5],[280.5,327.5],[281.5,329],[282,329],[282,330],[284,331.5],[284.5,333],[285,333],[285.5,335],[286,335],[286,336.5],[286.5,336.5],[286.5,337.5],[287,337.5],[287.5,342.5],[288,342.5],[288,347.5],[287.5,347.5],[287.5,350],[287,350],[287,351.5],[286.5,351.5],[286.5,352.5],[286,352.5],[286,353.5],[285.5,353.5],[285.5,354.5],[284.5,355],[284,356.5],[283.5,356.5],[283.5,357.5],[279.5,361],[279.5,361.5],[278.5,361.5],[278,362.5],[277,362.5],[276.5,363.5],[273.5,364.5],[273.5,365],[269,366],[269,366.5],[264,367],[264,367.5],[259.5,367.5],[259.5,368],[252.5,368],[252.5,367.5],[248.5,367.5],[248.5,367],[244,366.5],[244,366],[242.5,366],[242.5,365.5],[241,365.5],[241,365],[239.5,365],[239.5,364.5],[238.5,364.5],[238.5,364],[237,364],[237,363.5],[236,363.5],[236,363],[235,363],[235,362.5],[234,362.5],[234,362],[233,362],[233,361.5],[232,361.5],[232,361],[231,361],[231,360.5],[230,360.5],[230,360],[229,360],[228.5,359],[226.5,358.5],[226,357.5],[224,357],[223,355.5],[222,355.5],[218,351],[217.5,351],[217.5,350],[216,349],[216,348],[215,347.5],[215,346.5],[214,346],[213.5,344],[213,344],[213,342.5],[212.5,342.5],[212.5,340.5],[212,340.5],[212,336.5],[212.5,336.5],[212.5,334.5],[213,334.5],[213,333.5],[213.5,333.5]],
  "outerHoles": [],
  "trunkRiver": null,
  "regions": [
    {"id":"c08/r01","survey":"reported","areaKm2":446.25,"terrainKind":null,"biomeShares":{"meadow":86.1,"reef":12.1,"bramble":1.8},"rings":[[[239,318],[239.5,318],[239.5,317.5],[242.5,317.5],[242.5,317],[246.5,317],[246.5,316.5],[258.5,316.5],[258.5,317],[261,317],[261,317.5],[262.5,317.5],[262.5,318],[264.5,318],[264.5,318.5],[267.5,319],[267.5,319.5],[268.5,319.5],[268.5,320],[269.5,320],[269.5,320.5],[270.5,320.5],[270.5,321],[271.5,321],[271.5,321.5],[272.5,321.5],[272.5,322],[273,324.5],[274,325],[274,326.5],[273.5,326.5],[273.5,327.5],[273,327.5],[273,329],[272.5,329],[272,330.5],[269,331],[269,331.5],[267,331.5],[267,332],[263,332],[263,332.5],[259.5,333],[259.5,333.5],[254.5,333.5],[254.5,334],[253.5,334],[253.5,334.5],[252,334.5],[252,335],[251.5,335],[251.5,334.5],[250.5,334.5],[250.5,333.5],[249.5,333],[249.5,332],[248,331],[248,330.5],[247,330.5],[246,329],[245,329],[244,327.5],[243.5,327.5],[243.5,327],[242,326.5],[242,325],[242.5,325],[242.5,324.5],[242,324.5],[242,323.5],[241.5,323.5],[241.5,322],[241,322],[241,321],[240.5,321],[240.5,320],[239,319]]],"holes":[],"levelBand":[40,58],"adjacent":["c08/r03","c08/r04"],"centroidKm":[256.7,324.7],"settlements":[],"provenance":"hearsay"},
    {"id":"c08/r02","survey":"reported","areaKm2":446.25,"terrainKind":null,"biomeShares":{"meadow":80.7,"reef":18.4,"bramble":1},"rings":[[[213.5,332.5],[214,332.5],[214,332],[214,331.5],[218.5,327.5],[219,327.5],[220.5,325.5],[221.5,325.5],[222.5,324],[223.5,324],[224,323],[225.5,322.5],[226,322.5],[226,322],[226.5,322],[227,322],[227,321.5],[228,321.5],[228,321],[230.5,320.5],[230.5,320],[232,320],[232,319.5],[233.5,319.5],[233.5,319],[235,319],[235,318.5],[236.5,318.5],[236.5,319],[236,319],[236,320.5],[235.5,320.5],[235.5,322],[235,322],[235,323.5],[234.5,323.5],[234.5,325],[234,325],[234.5,328],[235,328],[235,330],[234.5,330],[234.5,331],[234,331],[234,332],[233.5,332],[233.5,333],[232,334],[231,337],[230.5,337],[230.5,338],[230,338],[230,339],[229,339.5],[228.5,341.5],[228,341.5],[227.5,345],[224.5,346],[224,347.5],[223.5,347.5],[223.5,348.5],[223,348.5],[223,349.5],[219.5,352.5],[217.5,351],[217.5,350],[216.5,349.5],[216.5,349],[216,349],[216,348],[215,347.5],[214.5,346],[214,346],[213.5,344],[213,344],[213,342.5],[212.5,342.5],[212,336.5],[212.5,336.5],[212.5,334.5],[213,334.5],[213,333.5],[213.5,333.5]]],"holes":[],"levelBand":[40,58],"adjacent":["c05/r18","c05/r20","c05/r26","c08/r03"],"centroidKm":[223.43,334.93],"settlements":[],"provenance":"inferred"},
    {"id":"c08/r03","survey":"reported","areaKm2":446.25,"terrainKind":null,"biomeShares":{"meadow":90.9,"reef":6.2,"bramble":2.9},"rings":[[[219.5,352.5],[223,349.5],[223,348.5],[223.5,348.5],[223.5,347.5],[224,347.5],[224.5,346],[227.5,345],[228,341.5],[228.5,341.5],[229,339.5],[230,339],[230,338],[230.5,338],[230.5,337],[231,337],[232,334],[233.5,333],[233.5,332],[234,332],[234,331],[234.5,331],[234.5,330],[235,330],[235,328],[234.5,328],[234,325],[234.5,325],[234.5,323.5],[235,323.5],[235,322],[235.5,322],[235.5,320.5],[236,320.5],[236,319],[236.5,319],[236.5,318.5],[237,318.5],[237,318],[239,318],[239,319],[240.5,320],[240.5,321],[241,321],[241,322],[241.5,322],[241.5,323.5],[242,323.5],[242,324.5],[242.5,324.5],[242.5,325],[242,325],[242,326.5],[243.5,327],[243.5,327.5],[244,327.5],[245,329],[246,329],[247,330.5],[248,330.5],[248,331],[249.5,332],[249.5,333],[250.5,333.5],[250.5,334.5],[251.5,334.5],[251.5,335],[251,335],[251,336.5],[251,337.5],[249,337.5],[249,338],[247.5,338],[247.5,338.5],[246,338.5],[246,339],[245,339],[245,339.5],[244,339.5],[243,341],[241,341.5],[241,342],[239.5,342],[239.5,342.5],[238,342.5],[238,343],[235.5,343.5],[235,344.5],[234.5,344.5],[234,347.5],[233.5,347.5],[233.5,349.5],[233,349.5],[233.5,351.5],[234,351.5],[234,352],[232.5,352],[232.5,353.5],[232,353.5],[232,354.5],[231.5,354.5],[231,357.5],[230.5,357.5],[230.5,359],[231,359],[231,360],[231.5,360],[231.5,361],[230,360.5],[230,360],[229,360],[228.5,359],[227.5,359],[227.5,358.5],[226.5,358.5],[226,357.5],[224,357],[223,355.5],[222,355.5],[220,353],[219.5,353]]],"holes":[],"levelBand":[40,58],"adjacent":["c08/r01","c08/r02","c08/r04","c08/r06","c08/r07"],"centroidKm":[235.46,339.21],"settlements":[],"provenance":"inferred"},
    {"id":"c08/r04","survey":"reported","areaKm2":446.25,"terrainKind":null,"biomeShares":{"meadow":92.7,"reef":6.9,"bramble":0.4},"rings":[[[251,336.5],[251,335],[251.5,335],[252,335],[252,334.5],[253.5,334.5],[253.5,334],[254.5,334],[254.5,333.5],[259.5,333.5],[259.5,333],[263,332.5],[263,332],[267,332],[267,331.5],[269,331.5],[269,331],[272,330.5],[272.5,329],[273,329],[273,327.5],[273.5,327.5],[273.5,326.5],[274,326.5],[274,325],[273,324.5],[272.5,322],[274,322.5],[274.5,323.5],[275.5,323.5],[276,324.5],[277,324.5],[279.5,327.5],[280.5,327.5],[280.5,328],[282,329],[282,330],[284,331.5],[284,332.5],[285,333],[285.5,335],[285.5,335.5],[284.5,335.5],[284.5,335],[283.5,335],[283.5,334.5],[282.5,334.5],[282.5,334],[281.5,334],[281.5,333.5],[280.5,333.5],[280.5,333],[279.5,333],[279.5,332.5],[276.5,332.5],[276.5,333],[275,333],[275,333.5],[274,333.5],[273.5,334.5],[273,334.5],[273.5,335.5],[272.5,336],[272.5,337],[273,337],[273,337.5],[272,338],[272.5,339.5],[271.5,340],[272.5,342],[272,342],[271.5,343.5],[271,343.5],[271.5,344.5],[271,344.5],[270.5,346],[270,346],[270,347.5],[270.5,347.5],[270.5,348],[270,348],[269.5,349.5],[269,349.5],[269.5,350.5],[269,350.5],[269,351.5],[268.5,351.5],[268.5,352.5],[268,352.5],[268,353.5],[267,354],[267.5,355],[267,355],[264,354.5],[264,354],[262.5,354.5],[262.5,353],[261.5,352.5],[261.5,352],[260.5,352],[259.5,350.5],[258,350.5],[258,350],[257,350],[257,349.5],[256,349.5],[253,346],[251.5,345.5],[252,343.5],[252.5,343.5],[252,342],[252.5,342],[253,340.5],[252.5,340.5],[252.5,338.5],[252,338.5],[252,336.5]]],"holes":[],"levelBand":[46,64],"adjacent":["c08/r01","c08/r03","c08/r05","c08/r07","c08/r08"],"centroidKm":[265.43,339.52],"settlements":[],"provenance":"hearsay"},